{
  "_meta": {
    "stage": "13-story",
    "by": "示例",
    "at": "2026-10-14T06:00:00+08:00"
  },
  "ep": 3,
  "lang": "zh",
  "paragraphs": [
    "早上，大家围着四个空杯子。浣熊举起爪子：“昨晚我可没出门！窗户开着，你们自己看！”",
    "咕咕博士检查了窗台，摇摇头：“窗台上没有脚印，窗外也没有。真有人爬窗进来，一定会留下痕迹。”",
    "波波鼠突然指着团子狗的尾巴大叫：“Look！珍珠！”——一颗珍珠，正粘在团子狗的尾巴尖上！",
    "“我就一直睡在沙发上啊……”团子狗挠挠头。咕咕博士推了推眼镜：“门是从里面锁上的。只有本来就在屋里的人，才喝得到奶茶。”",
    "“是你梦游啦！”大家一起喊。团子狗不好意思地笑了。当天晚上，浣熊又买了四杯奶茶，每杯都写上了名字。半夜，阁楼里又传来吸溜吸溜的声音——"
  ],
  "scene": [
    "dog:sleepy:150",
    "owl:think:150:magnifier",
    "mouse:surprise:150",
    "raccoon:smirk:150"
  ],
  "tbc": "这次又是谁？明天揭晓！To be continued…",
  "title_en": "The Pearl Tells the Truth",
  "title_zh": "珍珠的真相",
  "night": true,
  "clue": "侦探笔记：哪条线索证明不是有人爬窗进来？",
  "secret": "第3集真相：团子狗半夜梦游喝光了四杯奶茶。决定性证据是尾巴尖上粘着的珍珠；开着的窗户是干扰线索（窗台无脚印，已排除）。新悬念：半夜的吸溜声——第4集揭晓。",
  "bible_update": "第3集《珍珠的真相》：团子狗梦游喝光奶茶；新伏笔：半夜的吸溜声"
}